{
    "output": [
        {
            "transcription": "```json\n{\n  \"provenance\": {\n    \"movements\": [\n      {\n        \"source\": \"Unknown\",\n        \"target\": {\n          \"name\": \"Michaelis Israelski (Michael Illing)\",\n          \"location\": \"Berlin\",\n          \"birth_date\": \"1874\",\n          \"death_date\": \"1963\",\n          \"type\": \"Collector\"\n        },\n        \"start_time\": \"Unknown\",\n        \"end_time\": \"by 1926\",\n        \"location\": \"Berlin\",\n        \"method\": \"purchased by/acquired by (from/through/in)\"\n      },\n      {\n        \"source\": {\n          \"name\": \"Michaelis Israelski (Michael Illing)\",\n          \"location\": \"Berlin\",\n          \"birth_date\": \"1874\",\n          \"death_date\": \"1963\",\n          \"type\": \"Collector\"\n        },\n        \"target\": {\n          \"name\": \"Michaelis Israelski (Michael Illing)\",\n          \"location\": \"Berlin\",\n          \"birth_date\": \"1874\",\n          \"death_date\": \"1963\",\n          \"type\": \"Collector\"\n        },\n        \"start_time\": \"by 1926\",\n        \"end_time\": \"Unknown\",\n        \"location\": \"Berlin\",\n        \"method\": \"with\"\n      },\n      {\n        \"source\": {\n          \"name\": \"Michaelis Israelski (Michael Illing)\",\n          \"location\": \"Berlin\",\n          \"birth_date\": \"1874\",\n          \"death_date\": \"1963\",\n          \"type\": \"Collector\"\n        },\n        \"target\": {\n          \"name\": \"Private Collection\",\n          \"location\": \"Unknown\",\n          \"birth_date\": \"Unknown\",\n          \"death_date\": \"Unknown\",\n          \"type\": \"Collector\"\n        },\n        \"start_time\": \"after 1926\",\n        \"end_time\": \"before 1958\",\n        \"location\": \"Unknown\",\n        \"method\": \"Unknown\"\n      },\n      {\n        \"source\": {\n          \"name\": \"Private Collection\",\n          \"location\": \"Unknown\",\n          \"birth_date\": \"Unknown\",\n          \"death_date\": \"Unknown\",\n          \"type\": \"Collector\"\n        },\n        \"target\": {\n          \"name\": \"Private Collection\",\n          \"location\": \"Unknown\",\n          \"birth_date\": \"Unknown\",\n          \"death_date\": \"Unknown\",\n          \"type\": \"Collector\"\n        },\n        \"start_time\": \"before 1958\",\n        \"end_time\": \"before 1959\",\n        \"location\": \"Unknown\",\n        \"method\": \"with\"\n      },\n      {\n        \"source\": {\n          \"name\": \"Private Collection\",\n          \"location\": \"Unknown\",\n          \"birth_date\": \"Unknown\",\n          \"death_date\": \"Unknown\",\n          \"type\": \"Collector\"\n        },\n        \"target\": {\n          \"name\": \"Unknown\",\n          \"location\": \"Unknown\",\n          \"birth_date\": \"Unknown\",\n          \"death_date\": \"Unknown\",\n          \"type\": \"Unknown\"\n        },\n        \"start_time\": \"Unknown\",\n        \"end_time\": \"Unknown\",\n        \"location\": \"Unknown\",\n        \"method\": \"Unknown\"\n      },\n      {\n        \"source\": {\n          \"name\": \"Unknown\",\n          \"location\": \"Unknown\",\n          \"birth_date\": \"Unknown\",\n          \"death_date\": \"Unknown\",\n          \"type\": \"Unknown\"\n        },\n        \"target\": {\n          \"name\": \"Dr. Fritz Rothmann\",\n          \"location\": \"London\",\n          \"birth_date\": \"1893\",\n          \"death_date\": \"1983\",\n          \"type\": \"Dealer\"\n        },\n        \"start_time\": \"Unknown\",\n        \"end_time\": \"by 1959\",\n        \"location\": \"London\",\n        \"method\": \"purchased by/acquired by (from/through/in) (possibly)\"\n      },\n      {\n        \"source\": {\n          \"name\": \"Dr. Fritz Rothmann\",\n          \"location\": \"London\",\n          \"birth_date\": \"1893\",\n          \"death_date\": \"1983\",\n          \"type\": \"Dealer\"\n        },\n        \"target\": {\n          \"name\": \"Dr. Fritz Rothmann\",\n          \"location\": \"London\",\n          \"birth_date\": \"1893\",\n          \"death_date\": \"1983\",\n          \"type\": \"Dealer\"\n        },\n        \"start_time\": \"by 1959\",\n        \"end_time\": \"1959-09-02\",\n        \"location\": \"London\",\n        \"method\": \"with (possibly)\"\n      },\n      {\n        \"source\": {\n          \"name\": \"Dr. Fritz Rothmann\",\n          \"location\": \"London\",\n          \"birth_date\": \"1893\",\n          \"death_date\": \"1983\",\n          \"type\": \"Dealer\"\n        },\n        \"target\": {\n          \"name\": \"Galerie Fischer\",\n          \"location\": \"Lucerne, Switzerland\",\n          \"birth_date\": \"Unknown\",\n          \"death_date\": \"Unknown\",\n          \"type\": \"Institution\"\n        },\n        \"start_time\": \"1959-09-02\",\n        \"end_time\": \"1959-09-02\",\n        \"location\": \"Lucerne, Switzerland\",\n        \"method\": \"sold to (possibly)\"\n      },\n      {\n        \"source\": {\n          \"name\": \"Galerie Fischer\",\n          \"location\": \"Lucerne, Switzerland\",\n          \"birth_date\": \"Unknown\",\n          \"death_date\": \"Unknown\",\n          \"type\": \"Institution\"\n        },\n        \"target\": {\n          \"name\": \"Galerie Fischer\",\n          \"location\": \"Lucerne, Switzerland\",\n          \"birth_date\": \"Unknown\",\n          \"death_date\": \"Unknown\",\n          \"type\": \"Institution\"\n        },\n        \"start_time\": \"1959-09-02\",\n        \"end_time\": \"1959-11-24\",\n        \"location\": \"Lucerne, Switzerland\",\n        \"method\": \"with\"\n      },\n      {\n        \"source\": {\n          \"name\": \"Galerie Fischer\",\n          \"location\": \"Lucerne, Switzerland\",\n          \"birth_date\": \"Unknown\",\n          \"death_date\": \"Unknown\",\n          \"type\": \"Institution\"\n        },\n        \"target\": {\n          \"name\": \"Galerie Fischer\",\n          \"location\": \"Lucerne, Switzerland\",\n          \"birth_date\": \"Unknown\",\n          \"death_date\": \"Unknown\",\n          \"type\": \"Institution\"\n        },\n        \"start_time\": \"1959-11-24\",\n        \"end_time\": \"1959-11-30\",\n        \"location\": \"Lucerne, Switzerland\",\n        \"method\": \"consigned to (sale, Galerie Fischer, Lucerne, November 24\u201330, 1959, lot 2043, unsold)\"\n      },\n      {\n        \"source\": {\n          \"name\": \"Galerie Fischer\",\n          \"location\": \"Lucerne, Switzerland\",\n          \"birth_date\": \"Unknown\",\n          \"death_date\": \"Unknown\",\n          \"type\": \"Institution\"\n        },\n        \"target\": {\n          \"name\": \"Unknown\",\n          \"location\": \"Unknown\",\n          \"birth_date\": \"Unknown\",\n          \"death_date\": \"Unknown\",\n          \"type\": \"Unknown\"\n        },\n        \"start_time\": \"after 1959-11-30\",\n        \"end_time\": \"Unknown\",\n        \"location\": \"Unknown\",\n        \"method\": \"Unknown\"\n      },\n      {\n        \"source\": {\n          \"name\": \"Unknown\",\n          \"location\": \"Unknown\",\n          \"birth_date\": \"Unknown\",\n          \"death_date\": \"Unknown\",\n          \"type\": \"Unknown\"\n        },\n        \"target\": {\n          \"name\": \"S.F. Arnold\",\n          \"location\": \"Munich\",\n          \"birth_date\": \"Unknown\",\n          \"death_date\": \"Unknown\",\n          \"type\": \"Collector\"\n        },\n        \"start_time\": \"Unknown\",\n        \"end_time\": \"Unknown\",\n        \"location\": \"Munich\",\n        \"method\": \"purchased by/acquired by (from/through/in)\"\n      },\n      {\n        \"source\": {\n          \"name\": \"S.F. Arnold\",\n          \"location\": \"Munich\",\n          \"birth_date\": \"Unknown\",\n          \"death_date\": \"Unknown\",\n          \"type\": \"Collector\"\n        },\n        \"target\": {\n          \"name\": \"S.F. Arnold\",\n          \"location\": \"Munich\",\n          \"birth_date\": \"Unknown\",\n          \"death_date\": \"Unknown\",\n          \"type\": \"Collector\"\n        },\n        \"start_time\": \"Unknown\",\n        \"end_time\": \"1969-08-18\",\n        \"location\": \"Munich\",\n        \"method\": \"with\"\n      },\n      {\n        \"source\": {\n          \"name\": \"S.F. Arnold\",\n          \"location\": \"Munich\",\n          \"birth_date\": \"Unknown\",\n          \"death_date\": \"Unknown\",\n          \"type\": \"Collector\"\n        },\n        \"target\": {\n          \"name\": \"Monika Schaefer and Dr. Herbert Schaefer\",\n          \"location\": \"Malaga, Spain\",\n          \"birth_date\": \"Unknown\",\n          \"death_date\": \"Unknown\",\n          \"type\": \"Group\"\n        },\n        \"start_time\": \"1969-08-18\",\n        \"end_time\": \"1969-08-18\",\n        \"location\": \"Malaga, Spain\",\n        \"method\": \"Sold through Dieter Glocker\"\n      },\n      {\n        \"source\": {\n          \"name\": \"Monika Schaefer and Dr. Herbert Schaefer\",\n          \"location\": \"Malaga, Spain\",\n          \"birth_date\": \"Unknown\",\n          \"death_date\": \"Unknown\",\n          \"type\": \"Group\"\n        },\n        \"target\": {\n          \"name\": \"Monika Schaefer and Dr. Herbert Schaefer\",\n          \"location\": \"Malaga, Spain\",\n          \"birth_date\": \"Unknown\",\n          \"death_date\": \"Unknown\",\n          \"type\": \"Group\"\n        },\n        \"start_time\": \"1969-08-18\",\n        \"end_time\": \"2019\",\n        \"location\": \"Malaga, Spain\",\n        \"method\": \"(jointly owned)\"\n      },\n      {\n        \"source\": {\n          \"name\": \"Monika Schaefer and Dr. Herbert Schaefer\",\n          \"location\": \"Malaga, Spain\",\n          \"birth_date\": \"Unknown\",\n          \"death_date\": \"Unknown\",\n          \"type\": \"Group\"\n        },\n        \"target\": {\n          \"name\": \"Hamburger Kunsthalle\",\n          \"location\": \"Hamburg, Germany\",\n          \"birth_date\": \"Unknown\",\n          \"death_date\": \"Unknown\",\n          \"type\": \"Institution\"\n        },\n        \"start_time\": \"1969\",\n        \"end_time\": \"1977\",\n        \"location\": \"Hamburg, Germany\",\n        \"method\": \"on loan to\"\n      },\n      {\n        \"source\": {\n          \"name\": \"Monika Schaefer and Dr. Herbert Schaefer\",\n          \"location\": \"Malaga, Spain\",\n          \"birth_date\": \"Unknown\",\n          \"death_date\": \"Unknown\",\n          \"type\": \"Group\"\n        },\n        \"target\": {\n          \"name\": \"Norton Simon Collection\",\n          \"location\": \"Pasadena\",\n          \"birth_date\": \"Unknown\",\n          \"death_date\": \"Unknown\",\n          \"type\": \"Institution\"\n        },\n        \"start_time\": \"1978\",\n        \"end_time\": \"1981\",\n        \"location\": \"Pasadena\",\n        \"method\": \"on loan to\"\n      },\n      {\n        \"source\": {\n          \"name\": \"Monika Schaefer and Dr. Herbert Schaefer\",\n          \"location\": \"Malaga, Spain\",\n          \"birth_date\": \"Unknown\",\n          \"death_date\": \"Unknown\",\n          \"type\": \"Group\"\n        },\n        \"target\": {\n          \"name\": \"Yale University Art Gallery\",\n          \"location\": \"New Haven, Conn.\",\n          \"birth_date\": \"Unknown\",\n          \"death_date\": \"Unknown\",\n          \"type\": \"Institution\"\n        },\n        \"start_time\": \"1981\",\n        \"end_time\": \"2019\",\n        \"location\": \"New Haven, Conn.\",\n        \"method\": \"on loan to\"\n      },\n      {\n        \"source\": {\n          \"name\": \"Monika Schaefer and Dr. Herbert Schaefer\",\n          \"location\": \"Malaga, Spain\",\n          \"birth_date\": \"Unknown\",\n          \"death_date\": \"Unknown\",\n          \"type\": \"Group\"\n        },\n        \"target\": {\n          \"name\": \"Yale University Art Gallery\",\n          \"location\": \"New Haven, Conn.\",\n          \"birth_date\": \"Unknown\",\n          \"death_date\": \"Unknown\",\n          \"type\": \"Institution\"\n        },\n        \"start_time\": \"2020\",\n        \"end_time\": \"2020\",\n        \"location\": \"New Haven, Conn.\",\n        \"method\": \"bequeathed to\"\n      },\n      {\n        \"source\": {\n          \"name\": \"Yale University Art Gallery\",\n          \"location\": \"New Haven, Conn.\",\n          \"birth_date\": \"Unknown\",\n          \"death_date\": \"Unknown\",\n          \"type\": \"Institution\"\n        },\n        \"target\": {\n          \"name\": \"Yale University Art Gallery\",\n          \"location\": \"New Haven, Conn.\",\n          \"birth_date\": \"Unknown\",\n          \"death_date\": \"Unknown\",\n          \"type\": \"Institution\"\n        },\n        \"start_time\": \"2020\",\n        \"end_time\": \"Unknown\",\n        \"location\": \"New Haven, Conn.\",\n        \"method\": \"with\"\n      }\n    ]\n  }\n}\n```",
            "model": "google/gemini-2.5-pro-preview-03-25"
        }
    ],
    "provenance": "Michaelis Israelski (1874\u20131963), Berlin, by 1926 [see note 1]. Private Collection, before 1958. Possibly Dr. Fritz Rothmann (dealer, 1893\u20131983), London, by 1959; possibly sold to Galerie Fischer, Lucerne, Switzerland, September 2, 1959 [sale, Galerie Fischer, Lucerne, November 24\u201330, 1959, lot 2043 (unsold)] [see note 2]. S.F. Arnold, Munich; sold through Dieter Glocker, Wehen im Taunus, Germany, Monika Schaefer (nee Winter, died 2019) and Dr. Herbert Schaefer (1910\u20132011), Malaga, Spain, August 18, 1969 (on loan to the Hamburger Kunsthalle, Hamburg, Germany, to 1977) (on loan to the Norton Simon Collection, Pasadena, 1978\u201381) (on loan to the Yale University Art Gallery, New Haven, Conn., 1981\u20132019); bequeathed to the Yale University Art Gallery, New Haven, Conn., 2020\r\n\r\nNote 1: \u201cThomas\u201d was exhibited within the 1926 Lovis Corinth exhibition at the Nationalgalerie, Berlin, a loan from the collection of \u201cHerr M. Israelski.\u201d According to correspondence from the exhibition, Herr Israelski lived in Charlottenburg-Westend, Berlin, Bayernallee 36. In addition to \u201cThomas,\u201d he loaned a second painting by Corinth, \u201cFlieder,\u201d 1919, cat. no. 305.  (Letter from \u201cM. Israelski,\u201d to the Nationalgalerie, Berlin, January 12, 1926, courtesy Zentralarchiv, Staatliche Museen zu Berlin, copy in accession file). In May 1943, Israelski sold \u201cFlieder\u201d to the Galerie St. Etienne, New York (Letter from Dr. Otto Kallir, Galerie St. Etienne, New York, to Mr. M. Israelski, Los Angeles, May 13, 1943, courtesy Kallir Research Institute, New York, copy in accession file). Research conducted by the Gallery in 2023 has shown \u201cM. Israelski\u201d to be Michaelis Israelski (later Michael Illing, 1874\u20131963), a merchant, and founder and director of Israelski & Robinson AG., a footwear wholesaler in Berlin. \r\n\r\nNote 2: According to records of the Galerie Fischer, Lucerne, on September 2, 1959, Galerie Fischer bought an unspecified painting by Lovis Corinth from a \u201cMr. Dr. Rothmann, London.\u201d As the painting of Thomas was subsequently consigned to auction in November 1959 by the Galerie, it is possible the Galerie Fischer bought the painting in September and tried to sell it in November (Email from Galerie Fischer Archive, Lucerne, to the Gallery, March 21, 2024, copy in accession file)\r\n\r\nNote 3: According to records of the Galerie Fischer, Lucerne, the painting was consigned to auction from Galerie Fischer\u2019s stock (Email from Galerie Fischer Archive, Lucerne, to the Gallery, October 6, 2021, copy in accession file) \r\n",
    "object_id": 64324,
    "date": "2025-04-23 15:53:43"
}